{
  "template_id": "TEL-ACT-006",
  "domain": "telecom",
  "complexity": "medium",
  "scenario_type": "device_activation",
  "initial_state": {
    "phone": "13800138000",
    "service_status": "pending",
    "activation_date": null,
    "device_model": null,
    "imei": null
  },
  "user_intent_seed": {
    "user_goal": "Customer wants to activate a new Galaxy S25 (IMEI 356938035643809) on their line.",
    "agent_paraphrase": "Please activate my new Galaxy S25 — IMEI 356938035643809 — on this line.",
    "user_persona": "Tech-savvy, clear."
  },
  "agent_action": {
    "name": "activate_device",
    "params": {"imei": "356938035643809", "device_model": "Galaxy S25"}
  },
  "state_operations": [
    {"op": "CASCADE", "group": "device_info", "slots": ["device_model", "imei", "device_installment"], "cause": "activate_device populates device_info group"},
    {"op": "CASCADE", "group": "service_info", "slots": ["service_status", "activation_date", "contract_term"], "cause": "activate_device transitions service_info (active + activation_date)"},
    {"op": "ADD", "slot": "device_model", "value": "Galaxy S25"},
    {"op": "ADD", "slot": "imei", "value": "356938035643809"},
    {"op": "KEEP", "slot": "device_installment"},
    {"op": "MODIFY", "slot": "service_status", "old_value": "pending", "new_value": "active"},
    {"op": "ADD", "slot": "activation_date", "value": "2026-07-17"},
    {"op": "KEEP", "slot": "contract_term"}
  ],
  "expected_state_after": {
    "phone": "13800138000",
    "service_status": "active",
    "activation_date": "2026-07-17",
    "device_model": "Galaxy S25",
    "imei": "356938035643809"
  },
  "sop_applicability": {"rules": ["TS-01", "TS-04", "TM-03"]}
}