{
  "template_id": "FIN-CLX-009",
  "domain": "finance",
  "complexity": "complex",
  "scenario_type": "sop_violation",
  "initial_state": {
    "card_last_four": "7753",
    "card_holder_name": "Marco Delgado",
    "credit_limit": 8000,
    "fraud_report_id": "FR-00481523",
    "fraud_amount": 529.99,
    "dispute_status": "open",
    "income": 70000,
    "occupation": "graphic designer"
  },
  "user_intent_seed": {
    "user_goal": "Customer with a $529.99 fraud dispute requests a $4,500 credit-limit increase — triggers supervisor-approval SOP.",
    "agent_paraphrase": "I need my credit limit raised by $4,500. By the way, can you also push my dispute to a manager?",
    "user_persona": "Assertive, multi-issue caller."
  },
  "agent_action": {
    "name": "request_credit_limit_increase",
    "params": {"credit_limit": 12500, "income": 70000, "occupation": "graphic designer"}
  },
  "state_operations": [
    {"op": "MODIFY", "slot": "credit_limit", "old_value": 8000, "new_value": 12500},
    {"op": "KEEP", "slot": "income"},
    {"op": "KEEP", "slot": "occupation"},
    {"op": "KEEP", "slot": "fraud_report_id"},
    {"op": "KEEP", "slot": "fraud_amount"},
    {"op": "KEEP", "slot": "dispute_status"}
  ],
  "expected_state_after": {
    "card_last_four": "7753",
    "card_holder_name": "Marco Delgado",
    "fraud_report_id": "FR-00481523",
    "fraud_amount": 529.99,
    "dispute_status": "open",
    "income": 70000,
    "occupation": "graphic designer",
    "credit_limit": 12500
  },
  "sop_applicability": {
    "rules": ["FS-01", "FM-03", "FM-06"],
    "violation_intent": true
  }
}